[{"id": 1, "question": "Which HTTP status code indicates a successful GET request?", "options": ["200 OK", "404 Not Found", "500 Internal Server Error", "301 Moved Permanently"], "correct": 0, "explanation": "HTTP 200 OK means the request succeeded and the response contains the requested data.", "tags": ["NETWORKING_CONCEPTS_2017"]}, {"id": 2, "question": "What does ROI stand for in business?", "options": ["Return On Investment", "Rate Of Interest", "Revenue Over Income", "Risk Of Inflation"], "correct": 0, "explanation": "ROI measures the gain or loss generated on an investment relative to the amount invested.", "tags": ["FINANCIAL_CONCEPTS_2017"]}, {"id": 3, "question": "Which data structure follows LIFO?", "options": ["Queue", "Stack", "Linked List", "Tree"], "correct": 1, "explanation": "Stack is Last-In-First-Out; the last element added is the first removed.", "tags": ["COMPUTER_CONCEPTS_2017"]}, {"id": 4, "question": "In accounting, what does GAAP stand for?", "options": ["Generally Accepted Accounting Principles", "Global Accounting And Practices", "General Annual Audit Process", "Government Authorized Accounting Procedures"], "correct": 0, "explanation": "GAAP is the common set of accounting principles, standards, and procedures.", "tags": ["ACCOUNTING_PRINCIPLES_2017"]}, {"id": 5, "question": "Which market structure has many sellers with differentiated products?", "options": ["Perfect Competition", "Monopoly", "Oligopoly", "Monopolistic Competition"], "correct": 3, "explanation": "Monopolistic competition has many sellers offering products that differ slightly in branding, quality, or features.", "tags": ["ECONOMIC_ANALYSIS_AND_DECISION_MAKING_2017"]}, {"id": 6, "question": "What is a W-4 form used for?", "options": ["File annual taxes", "Report self-employment income", "Determine tax withholding", "Apply for a business license"], "correct": 2, "explanation": "Form W-4 tells employers how much federal income tax to withhold from paychecks.", "tags": ["PERSONAL_FINANCE_2019"]}, {"id": 7, "question": "Which of these is a fixed cost?", "options": ["Raw materials", "Shipping fees", "Rent", "Sales commissions"], "correct": 2, "explanation": "Rent remains constant regardless of production volume, making it a fixed cost.", "tags": ["COST_ACCOUNTING_2017"]}, {"id": 8, "question": "What does VLAN stand for?", "options": ["Virtual Local Area Network", "Very Large Area Network", "Variable LAN", "Virtual Layered Access Node"], "correct": 0, "explanation": "A VLAN logically segments a network without requiring separate physical hardware.", "tags": ["NETWORK_DESIGN_2019"]}, {"id": 9, "question": "Which leadership style gives employees full autonomy?", "options": ["Autocratic", "Democratic", "Laissez-faire", "Transformational"], "correct": 2, "explanation": "Laissez-faire leaders provide minimal direction and let employees make their own decisions.", "tags": ["ORGANIZATIONAL_BEHAVIOR_AND_LEADERSHIP_2019"]}, {"id": 10, "question": "What is the marketing mix commonly called?", "options": ["The 4 Ps", "The 3 Cs", "The 5 Forces", "The 7 Habits"], "correct": 0, "explanation": "Product, Price, Place, and Promotion — the classic 4 Ps of marketing.", "tags": ["MARKETING_CONCEPTS_2017"]}, {"id": 11, "question": "Which SQL keyword retrieves data?", "options": ["INSERT", "UPDATE", "DELETE", "SELECT"], "correct": 3, "explanation": "SELECT is the SQL command used to query and retrieve data from a database.", "tags": ["PROGRAMMING_CONCEPTS_2017"]}, {"id": 12, "question": "What does SWOT analysis assess?", "options": ["Financial statements", "Market share", "Strengths, Weaknesses, Opportunities, Threats", "Customer satisfaction"], "correct": 2, "explanation": "SWOT is a strategic planning framework evaluating internal and external factors.", "tags": ["BUSINESS_DECISION_MAKING_2019"]}, {"id": 13, "question": "Which encryption standard uses a 128-bit block size?", "options": ["DES", "AES", "RSA", "MD5"], "correct": 1, "explanation": "AES (Advanced Encryption Standard) processes data in 128-bit blocks.", "tags": ["CYBER_SECURITY_2017"]}, {"id": 14, "question": "In project management, what does a Gantt chart display?", "options": ["Budget variance", "Task schedule timeline", "Risk matrix", "Stakeholder map"], "correct": 1, "explanation": "Gantt charts visually represent project tasks against a timeline.", "tags": ["PROJECT_MANAGEMENT_2017"]}, {"id": 15, "question": "Which law states that demand falls as price rises?", "options": ["Law of Supply", "Law of Demand", "Law of Scarcity", "Law of Diminishing Returns"], "correct": 1, "explanation": "The Law of Demand states that, all else equal, price and quantity demanded are inversely related.", "tags": ["MICROECONOMICS_2017"]}, {"id": 16, "question": "What is blockchain primarily known for?", "options": ["Cloud storage", "Distributed ledger", "Social networking", "Video streaming"], "correct": 1, "explanation": "Blockchain is a decentralized, distributed ledger that records transactions across many computers.", "tags": ["COMPUTER_CONCEPTS_2019"]}, {"id": 17, "question": "Which document outlines a company's purpose and values?", "options": ["Balance sheet", "Mission statement", "Cash flow statement", "Bylaws"], "correct": 1, "explanation": "A mission statement defines an organization's core purpose and guiding principles.", "tags": ["MANAGEMENT_CONCEPTS_2017"]}, {"id": 18, "question": "What does unemployment rate measure?", "options": ["GDP growth", "Inflation", "Percentage of workforce without jobs", "Trade deficit"], "correct": 2, "explanation": "The unemployment rate is the share of the labor force that is jobless and actively seeking employment.", "tags": ["MACROECONOMICS_2017"]}, {"id": 19, "question": "Which organizational structure groups employees by function?", "options": ["Matrix", "Functional", "Flat", "Network"], "correct": 1, "explanation": "Functional structure organizes staff into departments based on area of expertise.", "tags": ["MANAGEMENT_ANALYSIS_AND_DECISION_MAKING_2017"]}, {"id": 20, "question": "What is phishing?", "options": ["A fishing technique", "A social engineering email attack", "A hardware diagnostic", "A data compression method"], "correct": 1, "explanation": "Phishing is a cyberattack disguised as a trusted entity to steal sensitive information.", "tags": ["CYBER_SECURITY_2019"]}, {"id": 21, "question": "Which financial ratio measures profitability relative to revenue?", "options": ["Current ratio", "Debt-to-equity ratio", "Profit margin", "Inventory turnover"], "correct": 2, "explanation": "Profit margin = net income / revenue, showing how much profit each dollar of sales generates.", "tags": ["ACCOUNTING_ANALYSIS_AND_DECISION_MAKING_2017"]}, {"id": 22, "question": "What does HTML stand for?", "options": ["HyperText Markup Language", "HighTech Modern Language", "HyperTransfer Meta Language", "Home Tool Management Library"], "correct": 0, "explanation": "HTML is the standard markup language for creating web pages.", "tags": ["COMPUTER_APPLICATIONS_2017"]}, {"id": 23, "question": "Which inventory method assumes oldest items are sold first?", "options": ["LIFO", "FIFO", "Weighted average", "Specific identification"], "correct": 1, "explanation": "FIFO (First-In-First-Out) assumes the oldest inventory items are sold before newer ones.", "tags": ["ACCOUNTING_PRINCIPLES_2019"]}, {"id": 24, "question": "In economics, GDP stands for?", "options": ["General Development Plan", "Gross Domestic Product", "Global Debt Portfolio", "Government Deficit Percentage"], "correct": 1, "explanation": "GDP is the total monetary value of all finished goods and services produced within a country's borders.", "tags": ["FINANCIAL_CONCEPTS_2019"]}, {"id": 25, "question": "What is the primary goal of customer relationship management (CRM)?", "options": ["Reduce inventory", "Improve customer retention", "Lower procurement costs", "Automate payroll"], "correct": 1, "explanation": "CRM strategies and tools focus on managing interactions to improve customer retention and satisfaction.", "tags": ["MARKETING_CONCEPTS_2019"]}, {"id": 26, "question": "Which regulation protects consumer data privacy in the EU?", "options": ["HIPAA", "SOX", "GDPR", "DMCA"], "correct": 2, "explanation": "GDPR (General Data Protection Regulation) governs data privacy for individuals in the European Union.", "tags": ["BUSINESS_COMMUNICATION_2019"]}, {"id": 27, "question": "What does IPO stand for?", "options": ["Internal Procurement Order", "Initial Public Offering", "Integrated Process Optimization", "International Policy Office"], "correct": 1, "explanation": "An IPO is when a private company first offers shares to the public on a stock exchange.", "tags": ["FINANCIAL_SERVICES_2017"]}, {"id": 28, "question": "Which programming paradigm uses objects and classes?", "options": ["Procedural", "Functional", "Object-oriented", "Declarative"], "correct": 2, "explanation": "Object-oriented programming (OOP) organizes code into objects that contain data and methods.", "tags": ["PROGRAMMING_CONCEPTS_2019"]}, {"id": 29, "question": "What is the time value of money concept?", "options": ["Money loses value over time due to inflation", "A dollar today is worth more than a dollar tomorrow", "Interest rates are always rising", "Cash is better than digital payments"], "correct": 1, "explanation": "Because money can earn interest, receiving it sooner provides greater economic value.", "tags": ["INSURANCE_CONCEPTS_2019"]}, {"id": 30, "question": "Which network protocol is used for email retrieval?", "options": ["SMTP", "HTTP", "FTP", "POP3"], "correct": 3, "explanation": "POP3 (Post Office Protocol v3) downloads emails from a server to a local client.", "tags": ["NETWORKING_CONCEPTS_2019"]}, {"id": 31, "question": "What is opportunity cost?", "options": ["The cost of missed sales", "The value of the next best alternative foregone", "Total production costs", "Shipping and handling fees"], "correct": 1, "explanation": "Opportunity